{
  "aging": {
    "lifespan_years": [
      2,
      8
    ]
  },
  "api_binding": {
    "authority": "NO_PRODUCTION_AUTHORITY",
    "mode": "READ_ONLY",
    "reference": "api.json"
  },
  "authority": {
    "legal_authority": false,
    "production_authority": false,
    "runtime_authority": false
  },
  "birth_or_formation_record": {
    "birth_mode": "egg_or_larval_candidate",
    "instant_formation": false,
    "status": "CANDIDATE_ONLY"
  },
  "civilization_role": {
    "aquaculture_role": "pond culture simulation",
    "predator_prey_role": "mid trophic link",
    "status": "CANDIDATE_ONLY"
  },
  "custody": {
    "custodian": "codex-gm-01-after-pr-review",
    "status": "PENDING_CODEX_REVIEW"
  },
  "damage": {
    "risks": [
      "low_oxygen",
      "thermal_stress",
      "predation",
      "disease"
    ]
  },
  "death_or_termination": {
    "conditions": [
      "anoxia",
      "temperature_out_of_range",
      "salinity_shock",
      "predation"
    ]
  },
  "density": {
    "unit": "kg/m3",
    "value": 1052.631579
  },
  "deterministic_seed": "KAIOS-PR67-SEED-FISH-001",
  "dimensions": {
    "body_depth_m": [
      0.02,
      0.16
    ],
    "length_range_m": [
      0.1,
      0.8
    ]
  },
  "display_name": "Foundational Fish Candidate",
  "economic_role": {
    "K11520_eligibility": "SIMULATED_K11520_ONLY",
    "civilization_requirement": "reviewed simulation context",
    "economic_value": {
      "basis": "Simulated aquaculture role, harvest output, and predator-prey ecosystem value only.",
      "mode": "SIMULATED"
    },
    "harvest_or_output": "simulated edible biomass",
    "labor_requirement": "simulated stewardship labor only",
    "maintenance_cost": "simulated monitoring cost only",
    "market_role": "SIMULATED_FOUNDATIONAL_RESOURCE",
    "resource_value": "aquaculture_role candidate",
    "rights_package": {
      "settlement": false,
      "status": "CANDIDATE_ONLY",
      "wallet": "NONE"
    },
    "supply_chain_inputs": [],
    "supply_chain_outputs": [],
    "technology_requirement": "local JSON validation only",
    "value_basis": "Simulated aquaculture role, harvest output, and predator-prey ecosystem value only."
  },
  "energy_model": {
    "metabolism": "aerobic_aquatic",
    "oxygen_required": true,
    "simulation_only": true,
    "source": "diet"
  },
  "environment_requirements": {
    "oxygen_mg_l": [
      5,
      12
    ],
    "salinity_ppt": [
      0,
      10
    ],
    "temperature_c": [
      12,
      28
    ],
    "water_type": [
      "freshwater",
      "brackish"
    ]
  },
  "event_log": [
    {
      "event_id": "EVT-LIFE-KAIOS-FOUNDATIONAL-FISH-001-0001",
      "next_state_hash": "9d1e8e5b0659b5719449ae03090e65246df2cfef5b5d2a4ee0f722db38118923",
      "previous_state_hash": null,
      "status": "PENDING_CODEX_REVIEW",
      "timestamp": "2026-08-01T06:25:03Z",
      "type": "CANDIDATE_PACKAGE_CREATED"
    }
  ],
  "extensions": [
    {
      "data": {
        "body_plan": "finned_vertebrate_candidate",
        "diet": [
          "algae",
          "invertebrates",
          "feed"
        ],
        "dissolved_oxygen_need": ">=5 mg/L",
        "health": "oxygen_temperature_diet_bound",
        "lifespan": "2-8 years",
        "metabolism": "aerobic",
        "movement": "swimming",
        "offspring": "larvae",
        "organs": [
          "gills",
          "fins",
          "digestive_system"
        ],
        "predator_prey": "mid_trophic_candidate",
        "reproduction": "egg_spawning",
        "salinity_range": "0-10 ppt",
        "senses": [
          "vision",
          "lateral_line"
        ],
        "sex": "candidate",
        "water_compatibility": "freshwater_to_brackish"
      },
      "extension_id": "MARINE_EXTENSION",
      "schema_version": "1.0.0"
    }
  ],
  "field_applicability": {
    "aging": {
      "reason": "aging is optional for MARINE_LIFE candidate validation.",
      "status": "OPTIONAL"
    },
    "api_binding": {
      "reason": "api_binding is required for MARINE_LIFE candidate validation.",
      "status": "REQUIRED"
    },
    "authority": {
      "reason": "authority is required for MARINE_LIFE candidate validation.",
      "status": "REQUIRED"
    },
    "birth_or_formation_record": {
      "reason": "birth_or_formation_record is required for MARINE_LIFE candidate validation.",
      "status": "REQUIRED"
    },
    "civilization_role": {
      "reason": "civilization_role is required for MARINE_LIFE candidate validation.",
      "status": "REQUIRED"
    },
    "custody": {
      "reason": "custody is required for MARINE_LIFE candidate validation.",
      "status": "REQUIRED"
    },
    "damage": {
      "reason": "damage is required for MARINE_LIFE candidate validation.",
      "status": "REQUIRED"
    },
    "death_or_termination": {
      "reason": "death_or_termination is required for MARINE_LIFE candidate validation.",
      "status": "REQUIRED"
    },
    "density": {
      "reason": "density is required for MARINE_LIFE candidate validation.",
      "status": "REQUIRED"
    },
    "deterministic_seed": {
      "reason": "deterministic_seed is required for MARINE_LIFE candidate validation.",
      "status": "REQUIRED"
    },
    "dimensions": {
      "reason": "dimensions is required for MARINE_LIFE candidate validation.",
      "status": "REQUIRED"
    },
    "display_name": {
      "reason": "display_name is required for MARINE_LIFE candidate validation.",
      "status": "REQUIRED"
    },
    "economic_role": {
      "reason": "economic_role is required for MARINE_LIFE candidate validation.",
      "status": "REQUIRED"
    },
    "energy_model": {
      "reason": "energy_model is required for MARINE_LIFE candidate validation.",
      "status": "REQUIRED"
    },
    "environment_requirements": {
      "reason": "environment_requirements is required for MARINE_LIFE candidate validation.",
      "status": "REQUIRED"
    },
    "event_log": {
      "reason": "event_log is required for MARINE_LIFE candidate validation.",
      "status": "REQUIRED"
    },
    "growth_or_development": {
      "reason": "growth_or_development is required for MARINE_LIFE candidate validation.",
      "status": "REQUIRED"
    },
    "health_or_integrity": {
      "reason": "health_or_integrity is required for MARINE_LIFE candidate validation.",
      "status": "REQUIRED"
    },
    "history": {
      "reason": "history is required for MARINE_LIFE candidate validation.",
      "status": "REQUIRED"
    },
    "integrity": {
      "reason": "integrity is required for MARINE_LIFE candidate validation.",
      "status": "REQUIRED"
    },
    "life_id": {
      "reason": "life_id is required for MARINE_LIFE candidate validation.",
      "status": "REQUIRED"
    },
    "life_type": {
      "reason": "life_type is required for MARINE_LIFE candidate validation.",
      "status": "REQUIRED"
    },
    "location": {
      "reason": "location is required for MARINE_LIFE candidate validation.",
      "status": "REQUIRED"
    },
    "mass": {
      "reason": "mass is required for MARINE_LIFE candidate validation.",
      "status": "REQUIRED"
    },
    "material_composition": {
      "reason": "material_composition is required for MARINE_LIFE candidate validation.",
      "status": "REQUIRED"
    },
    "mutation_or_change": {
      "reason": "mutation_or_change is required for MARINE_LIFE candidate validation.",
      "status": "REQUIRED"
    },
    "operation": {
      "reason": "operation is required for MARINE_LIFE candidate validation.",
      "status": "REQUIRED"
    },
    "origin": {
      "reason": "origin is required for MARINE_LIFE candidate validation.",
      "status": "REQUIRED"
    },
    "ownership": {
      "reason": "ownership is required for MARINE_LIFE candidate validation.",
      "status": "REQUIRED"
    },
    "provenance": {
      "reason": "provenance is required for MARINE_LIFE candidate validation.",
      "status": "REQUIRED"
    },
    "repair_or_healing": {
      "reason": "repair_or_healing is required for MARINE_LIFE candidate validation.",
      "status": "REQUIRED"
    },
    "reproduction_or_replication": {
      "reason": "reproduction_or_replication is optional for MARINE_LIFE candidate validation.",
      "status": "OPTIONAL"
    },
    "resource_inputs": {
      "reason": "resource_inputs is required for MARINE_LIFE candidate validation.",
      "status": "REQUIRED"
    },
    "resource_outputs": {
      "reason": "resource_outputs is required for MARINE_LIFE candidate validation.",
      "status": "REQUIRED"
    },
    "rights": {
      "reason": "rights is required for MARINE_LIFE candidate validation.",
      "status": "REQUIRED"
    },
    "runtime_binding": {
      "reason": "runtime_binding is required for MARINE_LIFE candidate validation.",
      "status": "REQUIRED"
    },
    "schema_version": {
      "reason": "schema_version is required for MARINE_LIFE candidate validation.",
      "status": "REQUIRED"
    },
    "scientific_or_system_name": {
      "reason": "scientific_or_system_name is required for MARINE_LIFE candidate validation.",
      "status": "REQUIRED"
    },
    "species_id": {
      "reason": "species_id is optional for MARINE_LIFE candidate validation.",
      "status": "OPTIONAL"
    },
    "taxonomy": {
      "reason": "taxonomy is required for MARINE_LIFE candidate validation.",
      "status": "REQUIRED"
    },
    "transfer": {
      "reason": "transfer is required for MARINE_LIFE candidate validation.",
      "status": "REQUIRED"
    },
    "usage": {
      "reason": "usage is required for MARINE_LIFE candidate validation.",
      "status": "REQUIRED"
    },
    "volume": {
      "reason": "volume is required for MARINE_LIFE candidate validation.",
      "status": "REQUIRED"
    },
    "world_viewer_binding": {
      "reason": "world_viewer_binding is required for MARINE_LIFE candidate validation.",
      "status": "REQUIRED"
    }
  },